{
  "schema_version": 1,
  "identity": {
    "scientific_sha256": "0000000000000000000000000000000000000000000000000000000000000000",
    "code_sha256": "0000000000000000000000000000000000000000000000000000000000000000",
    "data_sha256": "0000000000000000000000000000000000000000000000000000000000000000"
  },
  "files": [],
  "environment": {
    "note": "Synthetic schema example only."
  }
}
